audio,text
1,阳光洒在窗台上，暖洋洋的。
2,星星闪烁，点缀着深邃夜空。
3,咖啡的香气弥漫，让人心生惬意。
4,鸟儿在枝头欢快地歌唱不停。
5,这本书的故事引人入胜，无法自拔。
6,雨水敲打着窗户，声声入耳。
7,今天的晚餐，要做一份香喷喷的菜。
8,孩子们在草地上快乐地奔跑玩耍。
9,音乐的旋律，让人心情愉悦平和。
10,晚霞染红了天边，美不胜收。
11,他默默地走在回家的路上。
12,这幅画色彩鲜艳，充满活力。
13,花儿盛开，点缀着美丽庭院。
14,记住今天的快乐，明天继续前行。
15,努力工作，才能实现梦想。
16,认真思考，找到解决问题的办法。
17,珍惜每一天，活出精彩的人生。
18,静静地看着夕阳，感受美好时光。
19,梦想很美好，只要努力就能实现。
20,今天的天气真好，适合出门散步。
21,晨曦洒落，万物都焕发着生机。
22,他默默地阅读着，沉浸在书的海洋中。
23,蓝天白云下，孩子们欢快地奔跑着。
24,咖啡的香气弥漫，温暖着我的心房。
25,星星闪烁，仿佛在讲述古老的故事。
26,努力工作，才能实现自己的梦想。
27,时间过得真快，转眼就进入了冬季。
28,音乐的旋律，带他回到童年的记忆。
29,请保持微笑，生活充满阳光和希望。
30,昨夜的雨洗涤了城市的喧嚣。
31,他渴望着能够去探索未知的世界。
32,认真思考，才能找到解决问题的答案。
33,感受生活的美好，珍惜每一份幸福。
34,窗外传来鸟儿清脆的歌唱声。
35,即使失败了，也要保持积极乐观的态度。
36,他把所有的热情都投入到了创作中。
37,细雨如丝，滋润着大地的心田。
38,安静地坐下来，享受片刻的宁静。
39,成功需要勇气，更需要坚持不懈的努力。
40,晚霞绚丽，为白日的喧嚣画上句点。
41,阳光洒落，温暖着窗边的书籍。
42,城市夜空下，星光点点闪烁。
43,咖啡的香气弥漫，让人心旷神怡。
44,孩子们的欢笑声，充满了童真。
45,秋风瑟瑟，落叶在空中飞舞。
46,梦想的翅膀，需要勇敢的飞翔。
47,旅途的风景，永远值得去探索。
48,一本书，一个故事，无限的可能。
49,沉默有时比语言更有效。
50,努力工作，创造属于自己的价值。
51,远方的亲人，永远是温暖的力量。
52,记住那些曾经的美好时光。
53,每天进步一点点，积累成大成。
54,花开花落，皆是人生的风景。
55,保持乐观，积极面对生活中的挑战。
56,相信自己，你一定可以做到。
57,认真思考，才能找到解决问题的方法。
58,珍惜当下，活在每一天。
59,简单的快乐，才是最真实的幸福。
60,清晨的阳光，带来崭新的希望。
61,雨后的空气格外清新，带着泥土的芬芳。
62,他默默地坐在角落，沉浸在自己的世界里。
63,孩子们欢快地奔跑，笑声在空中回荡。
64,咖啡的香气，温暖了整个早晨。
65,那是一幅充满希望的画作，色彩斑斓。
66,我喜欢在夜晚，仰望星空，感受宁静。
67,时间总是过得很快，转瞬之间就是黄昏。
68,她用微笑，化解了所有尴尬和不安。
69,这场比赛的结果，令人失望至极。
70,阳光洒在身上，暖洋洋的，真舒服。
71,我决定去旅行，看看外面的世界。
72,书页翻动着，讲述着一个个动人的故事。
73,他认真地思考着，试图找到答案。
74,这片土地，承载着无数人的梦想与希望。
75,音乐的旋律，触动了我的心灵深处。
76,他收拾好行囊，准备出发去远方。
77,花儿绽放着美丽，迎接每一个阳光。
78,我渴望着改变，创造属于自己的未来。
79,他凝视着远方，眼神中充满憧憬。
80,窗外的风声，温柔地吹着我的脸庞。
81,阳光洒落，让房间变得温暖而舒适。
82,他独自坐在河边，思绪万千。
83,秋叶飘落，像是金色的精灵舞动。
84,孩子们在草地上欢快地奔跑着。
85,咖啡的香气弥漫，带来一丝放松。
86,星星在夜空中闪烁，点亮希望。
87,时间过得真快，转眼已是秋天。
88,我喜欢听雨声，它总能治愈心灵。
89,她轻轻地笑了，眼神里充满了温柔。
90,梦想的种子，需要阳光和雨露滋养。
91,这本书充满了引人入胜的故事。
92,今天的晚餐准备好了，味道很棒！
93,记住，无论发生什么，都要保持乐观。
94,他努力学习，希望考上理想的大学。
95,空气中弥漫着淡淡的花香，令人心旷神怡。
96,旅行的意义在于发现新的自我。
97,感谢你一直以来的陪伴和支持。
98,认真思考问题，才能找到最佳答案。
99,家是温暖的港湾，充满爱和关怀。
100,别害怕失败，每一次跌倒都是成长。